"Status","Start Time","Stop Time","Duration in ms","Parent Suite","Suite","Sub Suite","Test Class","Test Method","Name","Description"
"broken","Mon Mar 23 00:34:56 UTC 2026","Mon Mar 23 00:35:26 UTC 2026","30003","dream_platform.ui.tests","test_login","","","","test_cancel_logout","Test canceling logout keeps user on current page."
"broken","Mon Mar 23 00:37:00 UTC 2026","Mon Mar 23 00:37:30 UTC 2026","30002","dream_platform.ui.tests","test_user_page","","","","test_password_change_and_login","Test password change workflow and login validation with old/new passwords."
"failed","Mon Mar 23 00:34:51 UTC 2026","Mon Mar 23 00:34:56 UTC 2026","5093","dream_platform.ui.tests","test_login","","","","test_user_valid_login","User can log in successfully and see expected elements."
"broken","Mon Mar 23 00:36:30 UTC 2026","Mon Mar 23 00:37:00 UTC 2026","30002","dream_platform.ui.tests","test_user_page","","","","test_change_password_modal_elements","Check that change password modal elements are visible."
"passed","Mon Mar 23 00:34:48 UTC 2026","Mon Mar 23 00:34:49 UTC 2026","496","dream_platform.ui.tests","test_login","","","","test_login_page_elements_before_login","Check that all login page elements are visible before login."
"passed","Mon Mar 23 00:34:49 UTC 2026","Mon Mar 23 00:34:50 UTC 2026","1173","dream_platform.ui.tests","test_login","","","","test_logout","Test logout functionality and returning to login page."
"failed","Mon Mar 23 00:36:24 UTC 2026","Mon Mar 23 00:36:24 UTC 2026","0","dream_platform.ui.tests","test_user_page","","","","test_user_profile_page_visible","Check that user profile page elements are visible after login."
"passed","Mon Mar 23 00:35:27 UTC 2026","Mon Mar 23 00:35:29 UTC 2026","1051","dream_platform.ui.tests","test_forgot_password","","","","test_forgot_password_send_email_ui",""
"failed","Mon Mar 23 00:37:30 UTC 2026","Mon Mar 23 00:37:30 UTC 2026","0","dream_platform.ui.tests","test_user_timesheet","","","","test_timesheet_page_ui_elements","Check that Timesheet page elements are visible after login."
"passed","Mon Mar 23 00:34:51 UTC 2026","Mon Mar 23 00:34:51 UTC 2026","198","dream_platform.ui.tests","test_login","","","","test_invalid_login_wrong_password","Login should fail with wrong password."
"failed","Mon Mar 23 00:35:29 UTC 2026","Mon Mar 23 00:36:24 UTC 2026","55943","dream_platform.ui.tests","test_forgot_password","","","","test_forgot_password_full_flow","One full orchestrated test: send email → fetch → reset → verify → restore"
"passed","Mon Mar 23 00:34:49 UTC 2026","Mon Mar 23 00:34:49 UTC 2026","505","dream_platform.ui.tests","test_login","","","","test_admin_valid_login","Admin can log in successfully and see expected elements."
"passed","Mon Mar 23 00:34:51 UTC 2026","Mon Mar 23 00:34:51 UTC 2026","198","dream_platform.ui.tests","test_login","","","","test_invalid_login_wrong_username_and_password","Login should fail with wrong username and password."
"passed","Mon Mar 23 00:34:50 UTC 2026","Mon Mar 23 00:34:51 UTC 2026","212","dream_platform.ui.tests","test_login","","","","test_invalid_login_wrong_username","Login should fail with wrong username."
"passed","Mon Mar 23 00:35:26 UTC 2026","Mon Mar 23 00:35:27 UTC 2026","1191","dream_platform.ui.tests","test_forgot_password","","","","test_forgot_password_page_elements",""
"broken","Mon Mar 23 00:37:35 UTC 2026","Mon Mar 23 00:38:05 UTC 2026","30001","dream_platform.ui.tests","test_user_timesheet","","","","test_timesheet_add_and_submit_workflow","Test adding a timesheet entry and submitting the timesheet."
